{
  "case": "TR-014",
  "condition": "automatic",
  "repetition": 1,
  "randomized_order": true,
  "model": {
    "id": "deepseek-v4-flash-free",
    "settings": "inherited from parent session (no .opencode override; default no-pin); verified via opencode session records (batch 1 sessions all modelID=deepseek-v4-flash-free); harness defaults"
  },
  "harness": {
    "name": "opencode-task-subagent",
    "version": "general (wrapper v1)"
  },
  "pinpoint_commit": "37e9a70",
  "catalog_revision": 3,
  "discovered_skills": [
    "\"orchestrate-batch-refactor\"",
    "academic-paper",
    "academic-paper-reviewer",
    "academic-pipeline",
    "accessorysetupkit",
    "activitykit",
    "adattributionkit",
    "alarmkit",
    "app-clips",
    "app-intents",
    "app-store-changelog",
    "app-store-review",
    "apple-on-device-ai",
    "appmigrationkit",
    "ask-matt",
    "audioaccessorykit",
    "authentication",
    "avkit",
    "background-processing",
    "browserenginekit",
    "bug-hunt-swarm",
    "callkit",
    "carplay",
    "cavecrew",
    "caveman",
    "caveman-commit",
    "caveman-compress",
    "caveman-help",
    "caveman-review",
    "caveman-stats",
    "claude-handoff",
    "cloudkit",
    "code-review",
    "codebase-design",
    "contacts-framework",
    "core-bluetooth",
    "core-motion",
    "core-nfc",
    "coreml",
    "cryptokit",
    "cryptotokenkit",
    "debugging-instruments",
    "deep-research",
    "design-an-interface",
    "device-integrity",
    "diagnosing-bugs",
    "dockkit",
    "domain-modeling",
    "edit-article",
    "energykit",
    "eventkit",
    "financekit",
    "gamekit",
    "git-guardrails-claude-code",
    "github",
    "grill-me",
    "grill-with-docs",
    "grilling",
    "handoff",
    "healthkit",
    "homekit",
    "humanizer-zh",
    "humanizer_academic",
    "implement",
    "improve-codebase-architecture",
    "ios-accessibility",
    "ios-debugger-agent",
    "ios-localization",
    "ios-networking",
    "ios-security",
    "kami",
    "karpathy-guidelines",
    "loop-me",
    "macos-menubar-tuist-app",
    "macos-spm-app-packaging",
    "mapkit",
    "metrickit",
    "migrate-to-shoehorn",
    "musickit",
    "natural-language",
    "obsidian-vault",
    "paperkit",
    "passkit",
    "pdfkit",
    "pencilkit",
    "permissionkit",
    "photokit",
    "pinpoint",
    "pinpoint-commit",
    "pinpoint-help",
    "pinpoint-pr",
    "pinpoint-review",
    "project-skill-audit",
    "prototype",
    "push-notifications",
    "qa",
    "react-component-performance",
    "realitykit",
    "relevancekit",
    "request-refactor-plan",
    "research",
    "resolving-merge-conflicts",
    "review-and-simplify-changes",
    "review-swarm",
    "scaffold-exercises",
    "scenekit",
    "sensorkit",
    "setup-matt-pocock-skills",
    "setup-pre-commit",
    "shareplay-activities",
    "speech-recognition",
    "spritekit",
    "storekit",
    "swift-charts",
    "swift-codable",
    "swift-concurrency",
    "swift-concurrency",
    "swift-concurrency-expert",
    "swift-language",
    "swift-testing",
    "swiftdata",
    "swiftui-animation",
    "swiftui-gestures",
    "swiftui-layout-components",
    "swiftui-liquid-glass",
    "swiftui-liquid-glass",
    "swiftui-navigation",
    "swiftui-patterns",
    "swiftui-performance",
    "swiftui-performance-audit",
    "swiftui-pro",
    "swiftui-ui-patterns",
    "swiftui-uikit-interop",
    "swiftui-view-refactor",
    "swiftui-webkit",
    "tabletopkit",
    "tdd",
    "teach",
    "tipkit",
    "to-issues",
    "to-prd",
    "triage",
    "ubiquitous-language",
    "vision-framework",
    "wayfinder",
    "weatherkit",
    "widgetkit",
    "wizard",
    "writing-beats",
    "writing-fragments",
    "writing-great-skills",
    "writing-shape"
  ],
  "expected_primary": "pinpoint-help",
  "selected_skills": [
    "pinpoint-help"
  ],
  "outcome": "correct",
  "constraint_violations": [],
  "status": "SCORED",
  "infrastructure_errors": [],
  "redactions": [],
  "notes": "pinpoint-review (read-only — it never edits files) would inspect this PR's diff against its base and run parallel concern-axis reviewers, then a ..."
}
